[
    {
        "id":  "tokyo-asakusa-sensoji",
        "status":  "drafted",
        "bucket":  "tokyo",
        "names":  {
                      "ja":  "浅草寺と門前町",
                      "kana":  "せんそうじともんぜんまち",
                      "en":  "Sensō-ji and its temple town",
                      "former":  [

                                 ]
                  },
        "location":  {
                         "latitude":  35.7148,
                         "longitude":  139.7967,
                         "prefecture":  "Tokyo",
                         "municipality":  "Taitō",
                         "accuracyMeters":  100
                     },
        "story":  {
                      "headline":  "How a riverside pilgrimage site grew into an entertainment district",
                      "summary":  "Sensō-ji\u0027s own tradition dates its origin to a Kannon image found in the Sumida River in 628. Archaeological work confirms ancient and medieval activity at the site, while Taitō City records show how its temple town later became a center of crafts and popular entertainment.",
                      "body":  "Stand near Sensō-ji and look back toward the Sumida River. The temple’s origin story begins there: temple tradition says two fishermen pulled a statue of Kannon from the river in 628, and a local headman turned his home into a place of worship. Archaeology does not prove that sacred story, but excavations beneath the precinct have found ancient remains, coins and medieval roof tiles. They show that this was an active religious site across many centuries.\n\nAs worshippers arrived, a town grew around their route. Craftspeople and merchants gathered near the temple, while Nakamise developed along the approach between Kaminarimon and the inner gates. After the great Meireki fire of 1657, population and entertainment shifted toward Asakusa. The district later became one of Edo’s major places for performance and popular culture.\n\nMuch of the temple was destroyed in the 1945 air raids. The present main hall, completed in 1958, uses reinforced concrete while recalling older temple forms. What appears ancient is therefore a layered reconstruction: religious tradition, archaeological evidence, Edo commerce and postwar rebuilding occupy the same ground. Walk south through Nakamise, then continue toward Komagatadō. That small riverside hall marks the place associated in temple tradition with the statue’s discovery, reconnecting the crowded temple town to the water at the beginning of its story.",
                      "placeNameOrigin":  "The reading and early derivation of Asakusa are debated. This story does not present a single place-name theory as fact.",
                      "originCertainty":  "documented",
                      "sensitivity":  "religion",
                      "claims":  [
                                     {
                                         "id":  "asakusa-c1",
                                         "text":  "Sensō-ji tradition dates the discovery of the Kannon image in the Sumida River to 628.",
                                         "sourceIds":  [
                                                           "sensoji-official-history",
                                                           "taito-sensoji-archaeology"
                                                       ]
                                     },
                                     {
                                         "id":  "asakusa-c2",
                                         "text":  "Excavations found ancient remains, coins and medieval roof tiles beneath the precinct.",
                                         "sourceIds":  [
                                                           "taito-sensoji-archaeology"
                                                       ]
                                     },
                                     {
                                         "id":  "asakusa-c3",
                                         "text":  "Craft and entertainment districts grew around the temple town.",
                                         "sourceIds":  [
                                                           "taito-craft-history"
                                                       ]
                                     },
                                     {
                                         "id":  "asakusa-c4",
                                         "text":  "Nakamise occupies the approach from Kaminarimon toward Sensō-ji.",
                                         "sourceIds":  [
                                                           "taito-nakamise"
                                                       ]
                                     },
                                     {
                                         "id":  "asakusa-c5",
                                         "text":  "The present main hall was completed in reinforced concrete in 1958 after wartime destruction.",
                                         "sourceIds":  [
                                                           "taito-sensoji-visit"
                                                       ]
                                     },
                                     {
                                         "id":  "asakusa-c6",
                                         "text":  "Komagatadō marks the riverside place associated with the image\u0027s discovery.",
                                         "sourceIds":  [
                                                           "taito-komagata"
                                                       ]
                                     }
                                 ]
                  },
        "timeline":  [
                         {
                             "label":  "Temple tradition",
                             "year":  628,
                             "text":  "Two fishermen are said to have found a Kannon image in the Sumida River, leading to the temple’s origin.",
                             "sourceIds":  [
                                               "sensoji-official-history"
                                           ]
                         },
                         {
                             "label":  "Edo growth",
                             "year":  1657,
                             "text":  "After the Meireki fire, merchants, craftspeople and entertainment increasingly gathered around Asakusa.",
                             "sourceIds":  [
                                               "taito-craft-history"
                                           ]
                         },
                         {
                             "label":  "Wartime loss",
                             "year":  1945,
                             "text":  "The old main hall and other major structures were destroyed in the Tokyo air raids.",
                             "sourceIds":  [
                                               "taito-sensoji-visit"
                                           ]
                         },
                         {
                             "label":  "Rebuilt hall",
                             "year":  1958,
                             "text":  "The present reinforced-concrete main hall was completed.",
                             "sourceIds":  [
                                               "taito-sensoji-visit"
                                           ]
                         }
                     ],
        "nearby":  [
                       {
                           "name":  "Kaminarimon",
                           "distanceMeters":  260,
                           "latitude":  35.7111,
                           "longitude":  139.7964,
                           "sourceIds":  [
                                             "taito-nakamise"
                                         ]
                       },
                       {
                           "name":  "Nakamise",
                           "distanceMeters":  150,
                           "latitude":  35.7127,
                           "longitude":  139.7965,
                           "sourceIds":  [
                                             "taito-nakamise"
                                         ]
                       },
                       {
                           "name":  "Komagatadō",
                           "distanceMeters":  620,
                           "latitude":  35.7075,
                           "longitude":  139.7958,
                           "sourceIds":  [
                                             "taito-komagata"
                                         ]
                       }
                   ],
        "sources":  [
                        {
                            "id":  "sensoji-official-history",
                            "title":  "History of Senso-ji",
                            "publisher":  "Sensō-ji",
                            "url":  "https://www.senso-ji.jp/english/",
                            "accessedAt":  "2026-07-13",
                            "type":  "other",
                            "license":  "All rights reserved; link and paraphrase only"
                        },
                        {
                            "id":  "taito-sensoji-archaeology",
                            "title":  "浅草寺遺跡",
                            "publisher":  "Taitō City",
                            "url":  "https://www.city.taito.lg.jp/gakushu/shogaigakushu/shakaikyoiku/bunkazai/taitoukuiseki/taitoukunoiseki/sensoujiiseki.html",
                            "accessedAt":  "2026-07-13",
                            "type":  "municipal",
                            "license":  "Check municipal content terms before image use"
                        },
                        {